{
  "schemaVersion": 1,
  "catalogueStatus": "planned-not-release-evidence",
  "sourceOfTruth": "LloydCoder/web-temify-products",
  "policy": {
    "order": [
      "Tier 1",
      "Tier 4",
      "Tier 5",
      "Tier 2",
      "Tier 3"
    ],
    "coreScope": "39 standalone products and 4 launch kits",
    "additionalCandidates": "18 candidates are explicitly excluded from this core inventory until the core 43 are completed and validated",
    "releaseRule": "A catalogue entry is not proof that a product exists, builds, passes tests, has verified rights, or is safe to sell.",
    "stableIds": "Canonical productKey values are stable, unique, lowercase kebab-case identifiers derived from product names in this inventory revision; never recycle a key. Key changes require a reviewed migration.",
    "canonicalKeyRule": "Normalize product names to lowercase kebab-case, convert ampersand to 'and', slash to separator, preserve meaningful acronyms, and assert uniqueness in CI."
  },
  "products": [
    {
      "sequence": 1,
      "tier": "Tier 1",
      "name": "Courier & Logistics Template",
      "kind": "standalone",
      "status": "planned",
      "implementationEvidence": null,
      "rightsEvidence": null,
      "latestRelease": null,
      "productKey": "courier-and-logistics-template"
    },
    {
      "sequence": 2,
      "tier": "Tier 1",
      "name": "Loan & Lending Template",
      "kind": "standalone",
      "status": "planned",
      "implementationEvidence": null,
      "rightsEvidence": null,
      "latestRelease": null,
      "productKey": "loan-and-lending-template"
    },
    {
      "sequence": 3,
      "tier": "Tier 1",
      "name": "NeoBank & Digital Banking Template",
      "kind": "standalone",
      "status": "planned",
      "implementationEvidence": null,
      "rightsEvidence": null,
      "latestRelease": null,
      "productKey": "neobank-and-digital-banking-template"
    },
    {
      "sequence": 4,
      "tier": "Tier 1",
      "name": "Digital Agency Template",
      "kind": "standalone",
      "status": "planned",
      "implementationEvidence": null,
      "rightsEvidence": null,
      "latestRelease": null,
      "productKey": "digital-agency-template"
    },
    {
      "sequence": 5,
      "tier": "Tier 1",
      "name": "SaaS Landing Page Template",
      "kind": "standalone",
      "status": "planned",
      "implementationEvidence": null,
      "rightsEvidence": null,
      "latestRelease": null,
      "productKey": "saas-landing-page-template"
    },
    {
      "sequence": 6,
      "tier": "Tier 1",
      "name": "Portfolio & Freelancer Template",
      "kind": "standalone",
      "status": "planned",
      "implementationEvidence": null,
      "rightsEvidence": null,
      "latestRelease": null,
      "productKey": "portfolio-and-freelancer-template"
    },
    {
      "sequence": 7,
      "tier": "Tier 4",
      "name": "SaaS Starter Kit",
      "kind": "launch-kit",
      "status": "planned",
      "implementationEvidence": null,
      "rightsEvidence": null,
      "latestRelease": null,
      "productKey": "saas-starter-kit"
    },
    {
      "sequence": 8,
      "tier": "Tier 4",
      "name": "Web3 dApp Kit",
      "kind": "launch-kit",
      "status": "planned",
      "implementationEvidence": null,
      "rightsEvidence": null,
      "latestRelease": null,
      "productKey": "web3-dapp-kit"
    },
    {
      "sequence": 9,
      "tier": "Tier 4",
      "name": "Fintech Launch Kit",
      "kind": "launch-kit",
      "status": "planned",
      "implementationEvidence": null,
      "rightsEvidence": null,
      "latestRelease": null,
      "productKey": "fintech-launch-kit"
    },
    {
      "sequence": 10,
      "tier": "Tier 4",
      "name": "Agency Starter Kit",
      "kind": "launch-kit",
      "status": "planned",
      "implementationEvidence": null,
      "rightsEvidence": null,
      "latestRelease": null,
      "productKey": "agency-starter-kit"
    },
    {
      "sequence": 11,
      "tier": "Tier 5",
      "name": "Islamic Finance & Halal Banking",
      "kind": "standalone",
      "status": "planned",
      "implementationEvidence": null,
      "rightsEvidence": null,
      "latestRelease": null,
      "productKey": "islamic-finance-and-halal-banking"
    },
    {
      "sequence": 12,
      "tier": "Tier 5",
      "name": "Agritech & Farm Marketplace",
      "kind": "standalone",
      "status": "planned",
      "implementationEvidence": null,
      "rightsEvidence": null,
      "latestRelease": null,
      "productKey": "agritech-and-farm-marketplace"
    },
    {
      "sequence": 13,
      "tier": "Tier 5",
      "name": "ISP & Telecom Template",
      "kind": "standalone",
      "status": "planned",
      "implementationEvidence": null,
      "rightsEvidence": null,
      "latestRelease": null,
      "productKey": "isp-and-telecom-template"
    },
    {
      "sequence": 14,
      "tier": "Tier 5",
      "name": "Solar Energy Template",
      "kind": "standalone",
      "status": "planned",
      "implementationEvidence": null,
      "rightsEvidence": null,
      "latestRelease": null,
      "productKey": "solar-energy-template"
    },
    {
      "sequence": 15,
      "tier": "Tier 5",
      "name": "Ride-Hailing Landing Page",
      "kind": "standalone",
      "status": "planned",
      "implementationEvidence": null,
      "rightsEvidence": null,
      "latestRelease": null,
      "productKey": "ride-hailing-landing-page"
    },
    {
      "sequence": 16,
      "tier": "Tier 5",
      "name": "Ajo / Esusu Cooperative Savings Script",
      "kind": "standalone",
      "status": "planned",
      "implementationEvidence": null,
      "rightsEvidence": null,
      "latestRelease": null,
      "productKey": "ajo-esusu-cooperative-savings-script"
    },
    {
      "sequence": 17,
      "tier": "Tier 2",
      "name": "P2P Crypto Platform Script",
      "kind": "standalone",
      "status": "planned",
      "implementationEvidence": null,
      "rightsEvidence": null,
      "latestRelease": null,
      "productKey": "p2p-crypto-platform-script"
    },
    {
      "sequence": 18,
      "tier": "Tier 2",
      "name": "Online Banking Script",
      "kind": "standalone",
      "status": "planned",
      "implementationEvidence": null,
      "rightsEvidence": null,
      "latestRelease": null,
      "productKey": "online-banking-script"
    },
    {
      "sequence": 19,
      "tier": "Tier 2",
      "name": "Loan Management Script",
      "kind": "standalone",
      "status": "planned",
      "implementationEvidence": null,
      "rightsEvidence": null,
      "latestRelease": null,
      "productKey": "loan-management-script"
    },
    {
      "sequence": 20,
      "tier": "Tier 2",
      "name": "NFT Marketplace",
      "kind": "standalone",
      "status": "planned",
      "implementationEvidence": null,
      "rightsEvidence": null,
      "latestRelease": null,
      "productKey": "nft-marketplace"
    },
    {
      "sequence": 21,
      "tier": "Tier 2",
      "name": "Real Estate Template",
      "kind": "standalone",
      "status": "planned",
      "implementationEvidence": null,
      "rightsEvidence": null,
      "latestRelease": null,
      "productKey": "real-estate-template"
    },
    {
      "sequence": 22,
      "tier": "Tier 2",
      "name": "Invoice & Billing Script",
      "kind": "standalone",
      "status": "planned",
      "implementationEvidence": null,
      "rightsEvidence": null,
      "latestRelease": null,
      "productKey": "invoice-and-billing-script"
    },
    {
      "sequence": 23,
      "tier": "Tier 2",
      "name": "E-commerce Template",
      "kind": "standalone",
      "status": "planned",
      "implementationEvidence": null,
      "rightsEvidence": null,
      "latestRelease": null,
      "productKey": "e-commerce-template"
    },
    {
      "sequence": 24,
      "tier": "Tier 2",
      "name": "Restaurant Template",
      "kind": "standalone",
      "status": "planned",
      "implementationEvidence": null,
      "rightsEvidence": null,
      "latestRelease": null,
      "productKey": "restaurant-template"
    },
    {
      "sequence": 25,
      "tier": "Tier 2",
      "name": "Hospital Template",
      "kind": "standalone",
      "status": "planned",
      "implementationEvidence": null,
      "rightsEvidence": null,
      "latestRelease": null,
      "productKey": "hospital-template"
    },
    {
      "sequence": 26,
      "tier": "Tier 2",
      "name": "School Template",
      "kind": "standalone",
      "status": "planned",
      "implementationEvidence": null,
      "rightsEvidence": null,
      "latestRelease": null,
      "productKey": "school-template"
    },
    {
      "sequence": 27,
      "tier": "Tier 2",
      "name": "SaaS Dashboard Template",
      "kind": "standalone",
      "status": "planned",
      "implementationEvidence": null,
      "rightsEvidence": null,
      "latestRelease": null,
      "productKey": "saas-dashboard-template"
    },
    {
      "sequence": 28,
      "tier": "Tier 2",
      "name": "Point-of-Sale (POS) Script",
      "kind": "standalone",
      "status": "planned",
      "implementationEvidence": null,
      "rightsEvidence": null,
      "latestRelease": null,
      "productKey": "point-of-sale-pos-script"
    },
    {
      "sequence": 29,
      "tier": "Tier 3",
      "name": "Centralized Exchange (CEX) Lite",
      "kind": "standalone",
      "status": "planned",
      "implementationEvidence": null,
      "rightsEvidence": null,
      "latestRelease": null,
      "productKey": "centralized-exchange-cex-lite"
    },
    {
      "sequence": 30,
      "tier": "Tier 3",
      "name": "DeFi Dashboard",
      "kind": "standalone",
      "status": "planned",
      "implementationEvidence": null,
      "rightsEvidence": null,
      "latestRelease": null,
      "productKey": "defi-dashboard"
    },
    {
      "sequence": 31,
      "tier": "Tier 3",